{
  "blocking_unknowns": [],
  "control_operations": {
    "council": 0,
    "dashboard": 0,
    "delivery_ledger": 0,
    "git": 0,
    "thread": 0
  },
  "creative_directions": [
    {
      "claim": "少的是糖，不是拿铁这一口。",
      "key_visual": "拥挤的早高峰车厢被呈现为一个极简“编辑界面”：多余提醒、冗长等待和糖的数字依次被划掉；画面中央的 Luma Brew 瓶身与顺滑燕麦拿铁液体特写始终完整保留，最终定格产品与“每瓶含糖 3g”。",
      "mechanism_15s": "「早高峰删减键」：0-3 秒，通勤者被消息提醒、排队和车厢噪声包围；3-10 秒，每次喝一口，画面就用干净利落的删除动作减去一项不必要的负担，最后将糖收束为“3g”；10-15 秒，所有界面元素退场，只留下通勤者自然享受拿铁的表情、产品瓶和主张。机制靠“只删负担、不删口感”的连续视觉反差推进。",
      "name": "早高峰删减键",
      "why_it_fits": "直接回应受众“想少一点负担、又不愿牺牲口感”的核心矛盾；删除动作聪明、轻松且克制，不讨论体重，也不把用户置于被教育的位置。产品的 3g 糖证据是情节结论，而不是生硬贴上的参数。"
    },
    {
      "claim": "糖只坐 3g，拿铁感坐满全程。",
      "key_visual": "地铁座位上，一个极小但清晰可读的“3g 糖”座位标识只占画面一角；其余画面由燕麦拿铁的柔滑色泽、瓶身冷凝水和通勤者满足的一口占据，形成“小数字、完整体验”的尺度反差。",
      "mechanism_15s": "「3g 的一站」：0-4 秒，镜头模仿地铁报站：“下一站，早八”；一枚写着“3g 糖”的小乘车牌进入画面；4-11 秒，它在多个拥挤通勤场景中始终只占一个极小位置，而产品、燕麦基底的液体质感和饮用动作占据主画面；11-15 秒，报站声说“拿铁感，全程在线”，落产品、事实字幕“每瓶含糖 3g”和核心主张。机制是将抽象数字变成贯穿全片的微型通勤角色。",
      "name": "3g 的一站",
      "why_it_fits": "把最硬的产品证据转化为一眼可懂、可记忆的城市通勤符号，而不是做营养说教。尺度反差既能突出 3g，也能用充分的感官画面守住“口感没有被一起缩小”的品牌承诺；不依赖代言人或价格。"
    },
    {
      "claim": "冰箱拿起，顺滑直接到工位。",
      "key_visual": "一个不断被接续的流畅动作：手从冰箱拿出带冷凝水的 Luma Brew，瓶身经过电梯门、地铁闸机和写字楼门禁，每一次场景切换都由同一个“拿起—递进”动作无缝衔接；最后一口燕麦拿铁落在电脑亮起之前。",
      "mechanism_15s": "「一瓶到工位」：0-2 秒，清晨开冰箱，拿起冷藏 Luma Brew；2-12 秒，以瓶身为视觉接力棒，通过动作匹配完成家门、电梯、地铁、街口和工位的高速一镜到底。城市环境节奏急促，但每次饮用时声音与镜头短暂变得顺滑；12-15 秒，电脑开机、瓶子落桌，字幕依次出现“燕麦基底／冷藏即饮／每瓶含糖 3g”及核心主张。机制以连续动作证明产品如何自然进入通勤，而非依靠比喻解释。",
      "name": "一瓶到工位",
      "why_it_fits": "这一方向优先放大冷藏即饮的场景价值，再以燕麦基底的感官镜头和 3g 糖信息完成产品理由。它与前两条的图形删除、微型角色机制不同，是一支由动作、节奏和使用行为驱动的通勤影片，适合上海、北京、深圳共有的高密度移动场景。"
    }
  ],
  "material_insights": [
    "受众真正需要的不是一堂控糖课，而是一种无需在“少一点负担”和“拿铁口感”之间做明显妥协的早高峰选择。",
    "“每瓶含糖 3g”是本轮最具体、最有记忆潜力的证据；传播中应明确呈现为单瓶事实，不延伸成减肥、治疗、零糖或优于所有竞品的结论。",
    "燕麦基底负责支撑顺滑、轻松的感官联想；冷藏即饮负责证明产品与通勤场景的实际适配，两者应通过画面和行为体现，而不是堆砌功能文案。",
    "品牌语气应把低负担处理成一种聪明的小选择，而不是自律考核、身体焦虑或道德评判。",
    "三座城市的共通洞察是高密度、快节奏的早高峰，因此创意可使用地铁、闸机、电梯和工位等通用符号，不必依赖单一城市地标。"
  ],
  "next_content_action": "将三条方向分别扩写成 6-8 镜头的 15 秒分镜草案，并重点检验三件事：前 3 秒能否识别机制、产品是否在中段主动推动情节、结尾是否同时清楚留下“每瓶含糖 3g”和拿铁口感印象；继续采用无明星、无价格版本。",
  "non_blocking_unknowns": [
    "代言人尚未确定；当前三条机制均可由普通通勤者或手部表演完成，未来如启用代言人可替换人物而无需改变核心机制。",
    "最终零售价尚未确认；价格不进入本轮策略、主张或画面。"
  ],
  "strategy": "将 Luma Brew 定位为“早高峰里不必牺牲拿铁满足感的轻松减法”：传播不把低糖塑造成纪律或身体管理任务，而是用每瓶含糖 3g 的明确事实，解除消费者对“少糖可能等于少口感”的顾虑。创意表达遵循“先让人感到拿铁依然成立，再让 3g 成为可信理由”的顺序：燕麦基底和液体质感负责感官期待，冷藏即饮负责通勤便利，3g 糖负责理性确认。上海、北京、深圳执行均围绕普遍的早高峰移动行为展开，避免依赖价格、明星或未经证实的比较性结论。",
  "surface": "content"
}
